{
  "$schema": "https://json-schema.org/draft/2020-12/schema",
  "title": "Open-weight endpoint listed-price ledger",
  "type": "object",
  "required": ["ledger_version", "live", "as_of", "rows"],
  "additionalProperties": true,
  "properties": {
    "ledger_version": { "type": "string", "maxLength": 32 },
    "live": { "type": "boolean", "const": false },
    "as_of": { "type": "string", "pattern": "^[0-9]{4}-[0-9]{2}-[0-9]{2}$" },
    "rows": {
      "type": "array",
      "items": {
        "type": "object",
        "required": [
          "model_id",
          "provider",
          "price_in_per_m",
          "price_out_per_m",
          "tier",
          "quantization",
          "price_source_url",
          "fetched_at"
        ],
        "additionalProperties": true,
        "properties": {
          "model_id": { "type": "string", "minLength": 1, "maxLength": 256 },
          "provider": { "type": "string", "minLength": 1, "maxLength": 128 },
          "price_in_per_m": { "type": ["number", "null"], "minimum": 0 },
          "price_out_per_m": { "type": ["number", "null"], "minimum": 0 },
          "price_cache_per_m": { "type": ["number", "null"], "minimum": 0 },
          "tier": { "type": "string", "minLength": 1, "maxLength": 64 },
          "quantization": { "type": "string", "minLength": 1, "maxLength": 64 },
          "unlisted": { "type": "boolean" },
          "price_source_url": { "type": "string", "maxLength": 2048, "pattern": "^https://" },
          "fetched_at": { "type": "string", "pattern": "^[0-9]{4}-[0-9]{2}-[0-9]{2}$" }
        }
      }
    }
  }
}
